word,meaning
tacit,말없는, 잠자코 있는: 암묵의, 묵시적인
tactile,촉각의: 촉각을 가지고 있는
tamper,쓸데없는 참견을 하다. 간섭하다; 함부로 변경하다; 뇌물을 주다, 매수하다
tangible,만져 알 수 있는; 유형의, 실체가 있는; 명백한, 확실한
tarnish,흐려지다. 더러워지다; 흐리게 하다: 녹슬게 하다: 변색시키다; 명예를 더럽히다
taunt,조롱하다. 비웃다. 놀리다; 조롱, 조롱거리
tease,정보 따위를 기어이 얻어내다; 괴롭히다. 집적거리다 희롱하다; 조르다 졸라대다; 집적거림, 성가신 사람
tedious,지루한, 지겨운
temperamental,기질상의 개성이 강한; 흥분하기 쉬운, 신경질적인 변덕스러운
tenacious,고집하는, 고집이 센 집요한
tenet,교의, 주의, 신조
tentative,시험삼아 하는, 임시의; 주저하는; 불확실한, 모호한; 시험, 시도; 시안
tenuous,중요치 않은, 보잘것 없는; 얇은, 가느다란; 빈약한; 희박한
term,말; 술어 용어 전문어; 말씨, 어투,어구, 표현; 기간, 기한 임기; 회기; 학기; 조건, 조항; 가격, 수수료
terse,간결한, 간명한; 퉁명스러운; 무뚝뚝한
testify,증명 입증하다: 증거가 되다; 증인이 되다
throe,심한 고통; 진통: 임종의 고통
thoroughfare,도로, 가도; 한길, 주요 도로
threshold,입구, 문간; 문지방; 시초, 발단: 출발점
thrift,절약, 검약; 저축 금융 기관; 번성, 무성, 성장
thrive,번영하다. 번성하다
timid,겁 많은, 소심한, 내성적인
tolerance,관용, 관대: 포용력; 참음, 인내: 내구력
touchy,과민한; 성 잘 내는; 다루기 어려운
tractable,다루기 쉬운, 순종하는, 유순한